"regionn","regiond"
"Kanto","The Kanto region is a region of the Pokemon world. It is located east of Johto, and as revealed by the radio show Sinnoh Sound, is located south of Sinnoh. It was the first region to be introduced. It is the setting of the Generation I games, FireRed and LeafGreen, and Let's Go, Pikachu! and Let's Go, Eevee!; it is also accessible in Pokemon Gold, Silver, Crystal, HeartGold, and SoulSilver after the quest in Johto is completed."
"Johto","The Johto region is a region of the Pokemon world. It is located west of Kanto, and as revealed by the radio show Sinnoh Sound, is located south of Sinnoh. It is the setting of Pokemon Gold, Silver, Crystal, HeartGold, and SoulSilver. Johto and Kanto are part of a large landmass, with everything west of Indigo Plateau falling in the Johto region. It was the second main series region to be introduced."
"Hoenn","The Hoenn region is a region of the Pokemon world. It is located south of Sinnoh. It is the setting of Pokemon Ruby, Sapphire, Emerald, Omega Ruby, and Alpha Sapphire. It was the third main series region to be introduced."
"Sinnoh","The Sinnoh region is a region of the Pokemon world. It is located north of Kanto, Johto, and Hoenn. It is the setting of Pokemon Diamond, Pearl, and Platinum. It was the fourth main series region to be introduced. Sinnoh is composed of the large mainland, the north-eastern island of the Battle Zone, and several smaller islands on both sides of the region. Most of Sinnoh's routes are on land, having very few water routes, in vast contrast to Hoenn. The region is divided by Mt. Coronet, roughly comparable to how the continent that Kanto and Johto make up is essentially a contiguous region."
"Unova","The Unova region is a region of the Pokemon world. It is the setting of Pokemon Black and White and Pokemon Black 2 and White 2. It was the fifth main series region to be introduced. It is far away from the four other large regions, and the Pokemon which inhabit Unova are diverse and different from those of Kanto, Johto, Hoenn, and Sinnoh. In his director's column, Junichi Masuda suggested that the geographical and social background for Unova draws inspiration from the New York City metropolitan area. Although it is geographically based on New York City, it draws inspiration for its landmarks from the entire state of New York, which features a mixture of rural locations and urban areas as well as factory towns and industrial complexes."
"Kalos","Kalos is a region of the Pokemon world. It is the setting of Pokemon X and Y. It was the sixth main series region to be introduced. The Kalos region is shaped like a five-pointed star, with one of its biggest cities being Lumiose City in the north-central part of the region. It features a vast network of rivers and waterways snaking through much of its landscape, cities and towns. North-east of Lumiose City lies a mountain range where more frigid temperatures exist, extending down into the plains below. Western Kalos features a vast ocean, where the shoreside city of Shalour City lies in the middle of a cove."
"Alola","Alola is a region of the Pokemon world. It is the setting of Pokemon Sun, Moon, Ultra Sun, and Ultra Moon. It was the seventh main series region to be introduced. The Alola region is made up of four natural islands and one artificial island: Melemele Island, Akala Island, Ula'ula Island, Poni Island, and Aether Paradise. It is a popular resort destination and attracts a lot of tourists from other regions. In Alola, humans and Pokemon coexist in a very close relationship, and a culture has developed that is different from other regions."
